<?xml version="1.0" encoding="UTF-8"?>
<transcripts:transcripts xmlns:transcripts="http://www.example.org/Transcripts" xmlns:xsi="http://www.w3.org/2001/XMLSchema-instance" xsi:schemaLocation="http://www.example.org/Transcripts Transcripts.xsd ">
	<transcripts:transcript>
		<transcripts:name>John</transcripts:name>
		<transcripts:university>KTH</transcripts:university>
		<transcripts:degree>Master</transcripts:degree>
		<transcripts:courses>
			<transcripts:course>
				<transcripts:course_name>Web Service</transcripts:course_name>
				<transcripts:grade>A</transcripts:grade>
				<transcripts:ect>7.5</transcripts:ect>
			</transcripts:course>
			<transcripts:course>
				<transcripts:course_name>Modern Method</transcripts:course_name>
				<transcripts:grade>B</transcripts:grade>
				<transcripts:ect>7.5</transcripts:ect>
			</transcripts:course>
		</transcripts:courses>
	</transcripts:transcript>
</transcripts:transcripts>
