<?xml version="1.0" encoding="UTF-8"?>
<transcripts:transcripts xmlns:transcripts="http://www.example.org/Transcripts" xmlns:xsi="http://www.w3.org/2001/XMLSchema-instance" xsi:schemaLocation="http://www.example.org/Transcripts Transcripts.xsd ">
  <transcript>
    <name>Andy</name>
    <university>CTH</university>
    <degree>Master</degree>
    <courses>
    	<course>
    		<course_name>Distributed System</course_name>
    		<grade>B</grade>
    		<ect>7.5</ect>
    	</course>
    	<course>
    		<course_name>MultiAgentSystem</course_name>
    		<grade>A</grade>
    		<ect>7.5</ect>
    	</course>
    	<course>
    		<course_name>C</course_name>
    		<grade>B</grade>
    		<ect>7.5</ect>
    	</course>
    	<course>
    		<course_name>Software Engineering</course_name>
    		<grade>C</grade>
    		<ect>7.5</ect>
    	</course></courses>
  </transcript>
</transcripts:transcripts>
